{"id":"003-minor-ii-v","title":"Minor ii-V","standard":"Autumn Leaves","subtitle":"am7b5 to D7 into gm","duration":"13 min","standardPath":"/standards/autumn-leaves","promise":"Hear and play the minor cadence that pulls Autumn Leaves back into G minor.","why":"The minor ii-V is one of the most important sounds in jazz. Autumn Leaves gives you a clean, musical version of it without needing a theory dissertation in a trench coat.","progression":["am7b5","D7","gm7"],"voicings":[{"symbol":"am7b5","role":"ii half-diminished in gm","grip":"5-x-5-5-x-x","strings":["5","x","5","5","x","x"],"tones":["A","mute","G","C","mute","mute"],"function":"R - b7 - b3","note":"Keep this tense and unresolved. It is a setup chord."},{"symbol":"D7","role":"V7 in gm","grip":"x-5-4-5-x-x","strings":["x","5","4","5","x","x"],"tones":["mute","D","F#","C","mute","mute"],"function":"R - 3 - b7","note":"This chord wants to fall into G minor. Let the F# lead the ear."},{"symbol":"gm7","role":"i in gm","grip":"3-x-3-3-x-x","strings":["3","x","3","3","x","x"],"tones":["G","mute","F","Bb","mute","mute"],"function":"R - b7 - b3","note":"Resolve simply. Do not decorate before the landing is clear."}],"practice":["Play am7b5 -> D7 -> gm7 with no tempo.","Say half-diminished, dominant, minor home.","Repeat one chord per bar at 60 BPM.","Listen for F# resolving into G minor.","End by playing the A-section shells from lesson 001."],"listening":{"artist":"Jim Hall","note":"Listen for small voicings and clear harmonic gravity rather than speed."}}