{"id":"002-guide-tones","title":"Guide Tones","standard":"Autumn Leaves","subtitle":"3rds and 7ths through the A section","duration":"12 min","standardPath":"/standards/autumn-leaves","promise":"Track only the 3rds and 7ths so the harmony starts making sense under your fingers.","why":"Guide tones are the skeleton of jazz harmony. If you can hear and play these notes, the changes stop feeling like random chord names.","progression":["cm7","F7","Bbmaj7","Ebmaj7"],"voicings":[{"symbol":"cm7","role":"ii in Bb","grip":"x-x-1-3-x-x","strings":["x","x","1","3","x","x"],"tones":["mute","mute","Eb","Bb","mute","mute"],"function":"b3 - b7","note":"The minor sound is already here without the root."},{"symbol":"F7","role":"V7 in Bb","grip":"x-x-2-1-x-x","strings":["x","x","2","1","x","x"],"tones":["mute","mute","A","Eb","mute","mute"],"function":"3 - b7","note":"This is the dominant engine. Hear the tension."},{"symbol":"Bbmaj7","role":"I in Bb","grip":"x-x-3-2-x-x","strings":["x","x","3","2","x","x"],"tones":["mute","mute","D","A","mute","mute"],"function":"3 - 7","note":"Resolution, but still elegant and light."},{"symbol":"Ebmaj7","role":"IV in Bb","grip":"x-x-5-4-x-x","strings":["x","x","5","4","x","x"],"tones":["mute","mute","G","D","mute","mute"],"function":"3 - 7","note":"A soft lift into the next phrase."}],"practice":["Play only the two guide tones for each chord.","Move slowly through cm7 -> F7 -> Bbmaj7 -> Ebmaj7.","Say 3rd and 7th out loud.","Repeat at 60 BPM.","End by playing lesson 001 shells once."],"listening":{"artist":"Bill Evans Trio","note":"Listen for the inner voice movement, not just the melody."}}